,Title,Price,Link
0,Salsa Soja Clasica Lee Kum Kee 500ml Soy Sauce Natural,3103.11,https://www.mercadolibre.com.ar/salsa-soja-clasica-lee-kum-kee-500ml-soy-sauce-natural/p/MLA19620985
1,Salsa De Soja Premium Lee Kum Kee 150 Ml,3332.0,https://www.mercadolibre.com.ar/salsa-de-soja-premium-lee-kum-kee-150-ml/p/MLA19799334
2,Salsa Hoisin Lee Kum Kee 397gr,4889.01,https://www.mercadolibre.com.ar/salsa-hoisin-lee-kum-kee-397gr/p/MLA19783111
3,Aderezo Teriyaki Tau Delta X 320 Grs,1090.0,https://www.mercadolibre.com.ar/aderezo-teriyaki-tau-delta-x-320-grs/p/MLA22893959
4,Salsa De Soja Oscura Con Champiñon Lee Kum Kee 500 Ml,3327.48,https://www.mercadolibre.com.ar/salsa-de-soja-oscura-con-champinon-lee-kum-kee-500-ml/p/MLA20004952
5,Salsa De Soja Premium Lee Kum Kee 500 Ml,4284.0,https://www.mercadolibre.com.ar/salsa-de-soja-premium-lee-kum-kee-500-ml/p/MLA20004287
6,Salsa De Soja Reducida En Sodio Lee Kum Kee 500 Ml,6290.0,https://www.mercadolibre.com.ar/salsa-de-soja-reducida-en-sodio-lee-kum-kee-500-ml/p/MLA20004275
7,Salsa Estilo Teriyaki Lee Kum Kee 250ml Aderezo Salteado,5564.0,https://www.mercadolibre.com.ar/salsa-estilo-teriyaki-lee-kum-kee-250ml-aderezo-salteado/p/MLA20004048
8,"Salsa De Soja  X1,9 L Lee Kum Kee",9236.0,https://www.mercadolibre.com.ar/salsa-de-soja-x19-l-lee-kum-kee/p/MLA19950547
9,Salsa De Soja Kikkoman 1 Litro - Origen Oriental ,7780.0,https://www.mercadolibre.com.ar/salsa-de-soja-kikkoman-1-litro-origen-oriental/p/MLA20004022
10,Salsa De Soja Red Cocinero X 500 Cc,892.8,https://articulo.mercadolibre.com.ar/MLA-1147036437-salsa-de-soja-red-cocinero-x-500-cc-_JM
11,Salsa De Soja 160 Ml Zero Azúcar Mrs Taste Sin Tacc,3255.0,https://www.mercadolibre.com.ar/salsa-de-soja-160-ml-zero-azucar-mrs-taste-sin-tacc/p/MLA20004263
12,Salsa De Soja Agiibo 5 Lts Aderezo Cocina  Comida Japonesa,4562.5,https://www.mercadolibre.com.ar/salsa-de-soja-agiibo-5-lts-aderezo-cocina-comida-japonesa/p/MLA20004654
13,Salsa De Soja Light Fumeiga 1lt Para Sushi Bajo Sodio Cocina,2464.0,https://www.mercadolibre.com.ar/salsa-de-soja-light-fumeiga-1lt-para-sushi-bajo-sodio-cocina/p/MLA23879282
14,Salsa De Soja Bitarwan X 1lt,1982.0,https://www.mercadolibre.com.ar/salsa-de-soja-bitarwan-x-1lt/p/MLA21832876
15,Salsa De Soja 5 Litros Hei Mei,5499.0,https://www.mercadolibre.com.ar/salsa-de-soja-5-litros-hei-mei/p/MLA21634407
16,Salsa De Soja Bitarwan X 5 Litros,6999.0,https://www.mercadolibre.com.ar/salsa-de-soja-bitarwan-x-5-litros/p/MLA21789434
17,Salsa De Soja Fumeiga Cremosa 1lt Para Sushi Cocina Japon,2725.2,https://www.mercadolibre.com.ar/salsa-de-soja-fumeiga-cremosa-1lt-para-sushi-cocina-japon/p/MLA22317515
18,Salsa De Soja Kikkoman 1.6l,12160.0,https://www.mercadolibre.com.ar/salsa-de-soja-kikkoman-16l/p/MLA24112193
19,Salsa De Soja Light Bitarwan X 1 L,1974.0,https://www.mercadolibre.com.ar/salsa-de-soja-light-bitarwan-x-1-l/p/MLA21832872
20,Salsa De Soja Yamasa Tradicional 148 Ml.  ,5684.0,https://articulo.mercadolibre.com.ar/MLA-934810406-salsa-de-soja-yamasa-tradicional-148-ml-_JM
21,Salsa De Soja 500ml Vanoli,1165.0,https://www.mercadolibre.com.ar/salsa-de-soja-500ml-vanoli/p/MLA22761646
22,"Salsa De Soja Premium 1,9 L. Marca Haday",7885.0,https://www.mercadolibre.com.ar/salsa-de-soja-premium-19-l-marca-haday/p/MLA21832868
23,Salsa De Soja Yamasa Tradicional 459 Ml,10183.0,https://www.mercadolibre.com.ar/salsa-de-soja-yamasa-tradicional-459-ml/p/MLA21783597
24,Salsa De Soja Premium X150ml Lee Kum Kee,4090.0,https://articulo.mercadolibre.com.ar/MLA-884714777-salsa-de-soja-premium-x150ml-lee-kum-kee-_JM
25,Salsa De Soja Bitarwan En Botella 500 ml,1151.0,https://www.mercadolibre.com.ar/salsa-de-soja-bitarwan-en-botella-500ml/p/MLA21825895
26,Salsa De Soja Sin Sal Agregada 500 Ml Marca: Darama,1875.0,https://www.mercadolibre.com.ar/salsa-de-soja-sin-sal-agregada-500-ml-marca-darama/p/MLA21237875
27,Salsa De Soja  Shoyu Sakura Tradicional 1 Lt 100% Natural Sakura - 1 - Unidad - 1 - 1 L (incluye: Es Salsa),4890.0,https://www.mercadolibre.com.ar/salsa-de-soja-shoyu-sakura-tradicional-1-lt-100-natural-sakura-1-unidad-1-1-l-incluye-es-salsa/p/MLA21832883
28,Salsa De Soja Kikkoman,4800.0,https://www.mercadolibre.com.ar/salsa-de-soja-kikkoman/p/MLA23705213
29,Salsa De Soja Sakanashi Etiqueta Amarilla  X 970 Cc.,2200.0,https://www.mercadolibre.com.ar/salsa-de-soja-sakanashi-etiqueta-amarilla-x-970-cc/p/MLA20004557
30,Salsa De Soja Cepera Sin Tacc 150 Ml,1695.0,https://www.mercadolibre.com.ar/salsa-de-soja-cepera-sin-tacc-150-ml/p/MLA20004256
31,Salsa De Soja X 250ml - Hashi,764.0,https://www.mercadolibre.com.ar/salsa-de-soja-x-250ml-hashi/p/MLA19734534
32,Salsa De Soja Gell Singh Sin Sal Agregada - 3 Unidades,2143.0,https://www.mercadolibre.com.ar/salsa-de-soja-gell-singh-sin-sal-agregada-3-unidades/p/MLA21825897
33,Salsa De Soja Vanoli X 5l Sin Tacc,5313.0,https://articulo.mercadolibre.com.ar/MLA-920356604-salsa-de-soja-vanoli-x-5l-sin-tacc-_JM
34,Salsa De Pescado X 1.6 Lt Origen: China,7790.0,https://www.mercadolibre.com.ar/salsa-de-pescado-x-16-lt-origen-china/p/MLA22725090
35,Salsa De Soja Reduccion La Parmesana X1und 300cc,711.9,https://articulo.mercadolibre.com.ar/MLA-881125475-salsa-de-soja-reduccion-la-parmesana-x1und-300cc-_JM
36,Salsa De Soja Gluten Free Healthy Boy Brand 300g Tailandia,2240.0,https://www.mercadolibre.com.ar/salsa-de-soja-gluten-free-healthy-boy-brand-300g-tailandia/p/MLA21972479
37,Salsa De Soja Yamasa Reducida En Sodio - Origen Japones,8290.0,https://www.mercadolibre.com.ar/salsa-de-soja-yamasa-reducida-en-sodio-origen-japones/p/MLA19855088
38,Salsa De Soja Premium X 2lt Marca: Fumeiga,7055.0,https://www.mercadolibre.com.ar/salsa-de-soja-premium-x-2lt-marca-fumeiga/p/MLA21215820
39,Salsa De Soja 300 Ml Origen: China  100% Natural,4090.0,https://www.mercadolibre.com.ar/salsa-de-soja-300-ml-origen-china-100-natural/p/MLA22936286
40,Salsa De Soja Hinomoto X 500 Ml Tradicional,2060.0,https://www.mercadolibre.com.ar/salsa-de-soja-hinomoto-x-500-ml-tradicional/p/MLA24588568
41,Salsa De Soja 5 Litros Cia Aceitunera,6956.42,https://articulo.mercadolibre.com.ar/MLA-731602957-salsa-de-soja-5-litros-cia-aceitunera-_JM
42,Salsa De Soja Tradicional 1 Lt - Bitarwan ,1974.0,https://articulo.mercadolibre.com.ar/MLA-855338478-salsa-de-soja-tradicional-1-lt-bitarwan-_JM
43,Salsa De Soja Hinomoto Ligth 5 L - Sin Gluten,8950.0,https://www.mercadolibre.com.ar/salsa-de-soja-hinomoto-ligth-5-l-sin-gluten/p/MLA22437785
44,Salsa De Soja X 1 Lt Marca: Wan Ja Shan Origen: China,5062.5,https://articulo.mercadolibre.com.ar/MLA-851571605-salsa-de-soja-x-1-lt-marca-wan-ja-shan-origen-china-_JM
45,Salsa De Soja Oscura 500 Ml Haday -origen Oriental.,2200.0,https://www.mercadolibre.com.ar/salsa-de-soja-oscura-500-ml-haday-origen-oriental/p/MLA21832878
46,Salsa De Soja Fermantación Natural 1 L. Marca Wan Ja Shan Wan Ja Shan Salsa De Soja Salsa - 1 - Unidad - 1 - Botella (incluye: Es Salsa),3450.0,https://www.mercadolibre.com.ar/salsa-de-soja-fermantacion-natural-1-l-marca-wan-ja-shan-wan-ja-shan-salsa-de-soja-salsa-1-unidad-1-botella-incluye-es-salsa/p/MLA22120731
47,Salsa De Soja 1.6 L - Kikkoman,12900.0,https://articulo.mercadolibre.com.ar/MLA-861247230-salsa-de-soja-16-l-kikkoman-_JM
48,Salsa De Soja Hinomoto X 500 Ml Light Suave,2060.0,https://www.mercadolibre.com.ar/salsa-de-soja-hinomoto-x-500-ml-light-suave/p/MLA24576317
49,Salsa De Soja Kikkoman Reducida En Sodio 500 Ml,6136.0,https://www.mercadolibre.com.ar/salsa-de-soja-kikkoman-reducida-en-sodio-500-ml/p/MLA21208136
50,Pack 6u Salsa De Soja Hinomoto 1 Lt ,22015.0,https://articulo.mercadolibre.com.ar/MLA-782150547-pack-6u-salsa-de-soja-hinomoto-1-lt-_JM
51,Salsa De Soja Fumeiga Estilo Japones O Cremosa 1000ml,2649.0,https://articulo.mercadolibre.com.ar/MLA-910155758-salsa-de-soja-fumeiga-estilo-japones-o-cremosa-1000ml-_JM
52,Salsa De Soja Premium 750 Ml. Marca Haday,4580.0,https://www.mercadolibre.com.ar/salsa-de-soja-premium-750-ml-marca-haday/p/MLA21825894
53,Salsa A Base De Tamarindo 220 Ml Marca Darama,2742.0,https://www.mercadolibre.com.ar/salsa-a-base-de-tamarindo-220-ml-marca-darama/p/MLA21186584
54,Salsa De Soja Fumeiga 5litros,6568.0,https://articulo.mercadolibre.com.ar/MLA-862406120-salsa-de-soja-fumeiga-5litros-_JM
55,Salsa De Soja Extra Bitarwan  X 250 Ml,1890.0,https://www.mercadolibre.com.ar/salsa-de-soja-extra-bitarwan-x-250-ml/p/MLA24275653
56,Salsa De Ostras 700 Gr. Marca Haday,3250.0,https://www.mercadolibre.com.ar/salsa-de-ostras-700-gr-marca-haday/p/MLA21832875
57,Salsa De Soja Sakanashi Tradicional 900 Ml,2300.0,https://articulo.mercadolibre.com.ar/MLA-853991164-salsa-de-soja-sakanashi-tradicional-900-ml-_JM
58,Salsa De Soja Yamasa Tradicional 148ml,5700.0,https://www.mercadolibre.com.ar/salsa-de-soja-yamasa-tradicional-148ml/p/MLA19775223
59,Salsa De Soja Lee Kum Kee Premium Importada - 500 Ml,5296.0,https://articulo.mercadolibre.com.ar/MLA-814687418-salsa-de-soja-lee-kum-kee-premium-importada-500-ml-_JM
60,Salsa De Soja Blister Bitarwan 169unid 45cc. Tradicional ,13890.0,https://articulo.mercadolibre.com.ar/MLA-1356367535-salsa-de-soja-blister-bitarwan-169unid-45cc-tradicional-_JM
61,Salsa De Soja Cepera 150 Ml. Origen Brasil,2650.0,https://articulo.mercadolibre.com.ar/MLA-1124627342-salsa-de-soja-cepera-150-ml-origen-brasil-_JM
62,Salsa Teriyaki Hashi 250ml,1321.0,https://www.mercadolibre.com.ar/salsa-teriyaki-hashi-250ml/p/MLA20945717
63,Salsa De Soja Sakanashi X5litros X2unid Apto Kosher +envío ,19450.0,https://articulo.mercadolibre.com.ar/MLA-1366270187-salsa-de-soja-sakanashi-x5litros-x2unid-apto-kosher-envio-_JM
64,Pack X5 Salsa De Soja Sabor Hongo X500ml Lee Kum Kee,24199.0,https://articulo.mercadolibre.com.ar/MLA-885000707-pack-x5-salsa-de-soja-sabor-hongo-x500ml-lee-kum-kee-_JM
65,Salsa De Soja Yamasa Baja En Sodio Soy Sauce,7699.0,https://www.mercadolibre.com.ar/salsa-de-soja-yamasa-baja-en-sodio-soy-sauce/p/MLA19638989
66,Lee Kum Kee Salsa De Soja 500ml,4389.0,https://articulo.mercadolibre.com.ar/MLA-881840276-lee-kum-kee-salsa-de-soja-500ml-_JM
67,Salsa De Soja Oscura Haday - 1.75 L,6470.0,https://www.mercadolibre.com.ar/salsa-de-soja-oscura-haday-175-l/p/MLA24740695
68,Salsa De Soja Sakanashi X 450 Cc ,1092.96,https://www.mercadolibre.com.ar/salsa-de-soja-sakanashi-x-450-cc/p/MLA20945710
69,Salsa De Soja Sakanashi X5litros ,9900.0,https://articulo.mercadolibre.com.ar/MLA-1140910746-salsa-de-soja-sakanashi-x5litros-_JM
70,Salsa De Soja Hinomoto Ligth 5 L - Sin Gluten ,9980.0,https://articulo.mercadolibre.com.ar/MLA-909221976-salsa-de-soja-hinomoto-ligth-5-l-sin-gluten-_JM
71,Salsa De Soja Bitarwan 45cc (blister) Ideal Delivery 169 Und,15722.0,https://articulo.mercadolibre.com.ar/MLA-655537688-salsa-de-soja-bitarwan-45cc-blister-ideal-delivery-169-und-_JM
72,Salsa De Soja Bitarwan Tradicional X5litros X2unid  ,15890.0,https://articulo.mercadolibre.com.ar/MLA-1398527666-salsa-de-soja-bitarwan-tradicional-x5litros-x2unid-_JM
73,Salsa De Soja Haday 8 Un X 380ml China,3390.0,https://www.mercadolibre.com.ar/salsa-de-soja-haday-8-un-x-380ml-china/p/MLA24266810
74,Salsa De Soja X 5 Lt Marca: Fumeiga,5995.0,https://articulo.mercadolibre.com.ar/MLA-872493053-salsa-de-soja-x-5-lt-marca-fumeiga-_JM
75,Salsa Soja Sakanashi Kosher Bidón 5l Envios A Todo El Pais,8999.0,https://articulo.mercadolibre.com.ar/MLA-860104214-salsa-soja-sakanashi-kosher-bidon-5l-envios-a-todo-el-pais-_JM
76,Salsa De Soja Fumeiga Sachet 10 Cc X 100u Delivery,3740.0,https://articulo.mercadolibre.com.ar/MLA-780442036-salsa-de-soja-fumeiga-sachet-10-cc-x-100u-delivery-_JM
77,Salsa Soja Sakanashi 5 Litros Apto Kosher Envios A Todo,8999.0,https://articulo.mercadolibre.com.ar/MLA-851804953-salsa-soja-sakanashi-5-litros-apto-kosher-envios-a-todo-_JM
78,Salsa De Soja Dulce 400 Ml Origen: Tailandia,2135.0,https://www.mercadolibre.com.ar/salsa-de-soja-dulce-400-ml-origen-tailandia/p/MLA21168747
79,Salsa De Soja Fumeiga Premiun X 5 L,6850.0,https://www.mercadolibre.com.ar/salsa-de-soja-fumeiga-premiun-x-5-l/p/MLA20004992
80,Salsa De Soja Light Bitarwan Presentación 250cc Exquisita,1125.0,https://www.mercadolibre.com.ar/salsa-de-soja-light-bitarwan-presentacion-250cc-exquisita/p/MLA24240511
81,Salsa De Soja Sin Sal Gell Singh X 180 Cc Kosher,1227.0,https://articulo.mercadolibre.com.ar/MLA-883178058-salsa-de-soja-sin-sal-gell-singh-x-180-cc-kosher-_JM
82,Salsa De Soja Yamasa Reducida En Sodio - Origen Japones,12647.0,https://articulo.mercadolibre.com.ar/MLA-884049865-salsa-de-soja-yamasa-reducida-en-sodio-origen-japones-_JM
83,Salsa De Soja Wadakan X 1 Lt,5350.0,https://www.mercadolibre.com.ar/salsa-de-soja-wadakan-x-1-lt/p/MLA21237728
84,Salsa De Soja Shoyu Estilo Japonés X 500 Ml,1489.0,https://www.mercadolibre.com.ar/salsa-de-soja-shoyu-estilo-japones-x-500-ml/p/MLA21213043
85,Salsa De Soja Reducida En Sodio Lee Kum Kee 500 Ml,6349.0,https://articulo.mercadolibre.com.ar/MLA-1363539881-salsa-de-soja-reducida-en-sodio-lee-kum-kee-500-ml-_JM
86,Salsa De Soja Premium - Fumeiga - 5 Lts.,8190.0,https://articulo.mercadolibre.com.ar/MLA-1233131996-salsa-de-soja-premium-fumeiga-5-lts-_JM
87,Salsa De Soja - Kikkoman - 1.6 Lts. Origen Oriental.,15990.0,https://articulo.mercadolibre.com.ar/MLA-1273450256-salsa-de-soja-kikkoman-16-lts-origen-oriental-_JM
88,Salsa De Soja Sakanashi Etiqueta Amarilla  X 970 Cc.,2265.0,https://articulo.mercadolibre.com.ar/MLA-849967688-salsa-de-soja-sakanashi-etiqueta-amarilla-x-970-cc-_JM
89,Salsa De Soja Enrico Baronese X 5 L Ventas X Mayor Y Menor,5500.0,https://articulo.mercadolibre.com.ar/MLA-1104001529-salsa-de-soja-enrico-baronese-x-5-l-ventas-x-mayor-y-menor-_JM
90,Pack X3 Salsa De Soja X500ml Lee Kum Kee,13999.0,https://articulo.mercadolibre.com.ar/MLA-883277724-pack-x3-salsa-de-soja-x500ml-lee-kum-kee-_JM
91,Salsa De Soja - Fumeiga - Sachet 10cc X 100 Unidades.,3890.0,https://articulo.mercadolibre.com.ar/MLA-1165535642-salsa-de-soja-fumeiga-sachet-10cc-x-100-unidades-_JM
92,Salsa De Soja Dulce 190 Gr.,1899.0,https://www.mercadolibre.com.ar/salsa-de-soja-dulce-190-gr/p/MLA21251333
93,Salsa De Soja Vanoli 1l Sin Tacc ,1549.0,https://articulo.mercadolibre.com.ar/MLA-913468952-salsa-de-soja-vanoli-1l-sin-tacc-_JM
94,Salsa De Soja - Yamasa - 1 Lt. Origen Japón.,9990.0,https://articulo.mercadolibre.com.ar/MLA-1278607772-salsa-de-soja-yamasa-1-lt-origen-japon-_JM
95,Salsa De Soja Fumeiga Premiun X 5 L,7967.0,https://articulo.mercadolibre.com.ar/MLA-1428955032-salsa-de-soja-fumeiga-premiun-x-5-l-_JM
96,Salsa De Soja Gell Singh Sin Sodio 180 Cc - 3 Unidades,3097.0,https://articulo.mercadolibre.com.ar/MLA-1152308701-salsa-de-soja-gell-singh-sin-sodio-180-cc-3-unidades-_JM
97,Gluten Free- Salsa De Soja Hinomoto 500 Ml.,2390.0,https://articulo.mercadolibre.com.ar/MLA-1160746919-gluten-free-salsa-de-soja-hinomoto-500-ml-_JM
98,Salsa De Soja Sakura Tradicional O Light Importado 1000ml ,3749.0,https://articulo.mercadolibre.com.ar/MLA-910149836-salsa-de-soja-sakura-tradicional-o-light-importado-1000ml-_JM
99,Salsa De Soja Bitarwan Tradicional X5litros ,7400.0,https://articulo.mercadolibre.com.ar/MLA-1383049515-salsa-de-soja-bitarwan-tradicional-x5litros-_JM
100,Salsa De Soja Fumeiga Sachet 10 Cc X 100u ,3396.0,https://articulo.mercadolibre.com.ar/MLA-825169437-salsa-de-soja-fumeiga-sachet-10-cc-x-100u-_JM
101,Salsas Tahití Soja Pack X 6 Unidades. Y También Otros Gustos,4313.0,https://articulo.mercadolibre.com.ar/MLA-1451894990-salsas-tahiti-soja-pack-x-6-unidades-y-tambien-otros-gustos-_JM
102,Salsa De Soja Light Hinomoto 1 Litro Importado Brasil,3459.0,https://articulo.mercadolibre.com.ar/MLA-1150446320-salsa-de-soja-light-hinomoto-1-litro-importado-brasil-_JM
103,Pampa Gourmet Salsa Teriyaki Con Vino Torrontes X 285grs,2299.0,https://www.mercadolibre.com.ar/pampa-gourmet-salsa-teriyaki-con-vino-torrontes-x-285grs/p/MLA19686593
104,Salsa De Soja Premium Lee Kum Kee 500ml Importado,4819.0,https://articulo.mercadolibre.com.ar/MLA-912094293-salsa-de-soja-premium-lee-kum-kee-500ml-importado-_JM
105,Salsa De Soja X500ml Lee Kum Kee,4510.0,https://articulo.mercadolibre.com.ar/MLA-883276926-salsa-de-soja-x500ml-lee-kum-kee-_JM
106,Pack X4 Salsa De Soja X500ml Lee Kum Kee,18799.0,https://articulo.mercadolibre.com.ar/MLA-883278285-pack-x4-salsa-de-soja-x500ml-lee-kum-kee-_JM
107,Pack X 3  Salsas - Soja + Ostra + Teriyaki. Origen Oriental.,8690.0,https://articulo.mercadolibre.com.ar/MLA-1361775681-pack-x-3-salsas-soja-ostra-teriyaki-origen-oriental-_JM
108,Salsa De Soja Hinomoto 1 Litro Sin Gluten - Origen Brasil,3150.0,https://articulo.mercadolibre.com.ar/MLA-876845902-salsa-de-soja-hinomoto-1-litro-sin-gluten-origen-brasil-_JM
109,Salsa De Soja Bitarwan Blister 45cc Envios 169 Und,9999.0,https://articulo.mercadolibre.com.ar/MLA-865028736-salsa-de-soja-bitarwan-blister-45cc-envios-169-und-_JM
110,Salsa De Soja Yamasa X 500 Ml,5410.0,https://www.mercadolibre.com.ar/salsa-de-soja-yamasa-x-500-ml/p/MLA20004338
111,Salsa De Soja Light  Reducida En Sodio Cepera 270 Ml.,4645.0,https://articulo.mercadolibre.com.ar/MLA-1408955912-salsa-de-soja-light-reducida-en-sodio-cepera-270-ml-_JM
112,Salsa De Soja Premium Marca Fumeiga 1 Lt,2500.0,https://articulo.mercadolibre.com.ar/MLA-1103693547-salsa-de-soja-premium-marca-fumeiga-1-lt-_JM
113,Salsa De Soja Soy Sauce 500 Ml - Fumeiga,1165.0,https://articulo.mercadolibre.com.ar/MLA-880331049-salsa-de-soja-soy-sauce-500-ml-fumeiga-_JM
114,Salsa De Soja Premium 1 Litro - Fumeiga,2464.0,https://articulo.mercadolibre.com.ar/MLA-876436198-salsa-de-soja-premium-1-litro-fumeiga-_JM
115,Salsa De Soja Yamasa Reducida En Sodio 148 Ml.  ,7104.0,https://articulo.mercadolibre.com.ar/MLA-934810713-salsa-de-soja-yamasa-reducida-en-sodio-148-ml-_JM
116,Salsa Tonkatsu 250 Ml Hashi - Origen Argentina,1196.0,https://www.mercadolibre.com.ar/salsa-tonkatsu-250-ml-hashi-origen-argentina/p/MLA21268394
117,Salsa De Soja Bitarwan 5 Lt X 4 Und + Envio Gratis ,34695.0,https://articulo.mercadolibre.com.ar/MLA-1371376059-salsa-de-soja-bitarwan-5-lt-x-4-und-envio-gratis-_JM
118,Salsa De Soja Premium - Hinomoto - 1 Litro. Origen Brasil.,4619.88,https://articulo.mercadolibre.com.ar/MLA-1276054413-salsa-de-soja-premium-hinomoto-1-litro-origen-brasil-_JM
119,Salsa De Soja Bidon X 5 Litros Marca Hei Men,5225.0,https://articulo.mercadolibre.com.ar/MLA-1104210266-salsa-de-soja-bidon-x-5-litros-marca-hei-men-_JM
120,Salsa De Soja Cremosa Marca Fumeiga 1 Lt,2812.5,https://articulo.mercadolibre.com.ar/MLA-1103716870-salsa-de-soja-cremosa-marca-fumeiga-1-lt-_JM
121,Salsa De Soja Dulce 970g - Origen Tailandia Tailandia Soja Dulce Salsa - 1 - Unidad - 1 - 970 Ml - 970 G - Botella (incluye: Es Salsa),5235.0,https://www.mercadolibre.com.ar/salsa-de-soja-dulce-970g-origen-tailandia-tailandia-soja-dulce-salsa-1-unidad-1-970-ml-970-g-botella-incluye-es-salsa/p/MLA23487003
122,Salsa De Soja Tradicional 5 L - Hinomoto ,9980.0,https://articulo.mercadolibre.com.ar/MLA-918614770-salsa-de-soja-tradicional-5-l-hinomoto-_JM
123,"Salsa De Soja Tradicional X1,90l Uso Gastronómico Lee Kumkee",9735.0,https://articulo.mercadolibre.com.ar/MLA-819637560-salsa-de-soja-tradicional-x190l-uso-gastronomico-lee-kumkee-_JM
124,Salsa De Soja Light Fumeiga 1lt Para Sushi Bajo Sodio Cocina,2655.0,https://articulo.mercadolibre.com.ar/MLA-689635082-salsa-de-soja-light-fumeiga-1lt-para-sushi-bajo-sodio-cocina-_JM
125,"Salsa De Soja Light X500g, Lee Kum Kee",6761.0,https://articulo.mercadolibre.com.ar/MLA-930872440-salsa-de-soja-light-x500g-lee-kum-kee-_JM
126,Salsa De Soja Yamasa Tradicional Soy Sauce - 01mercado,12647.0,https://articulo.mercadolibre.com.ar/MLA-1100178639-salsa-de-soja-yamasa-tradicional-soy-sauce-01mercado-_JM
127,Salsa De Soja Yamasa Reducida En Sodio 148 Ml,6700.0,https://articulo.mercadolibre.com.ar/MLA-916042004-salsa-de-soja-yamasa-reducida-en-sodio-148-ml-_JM
128,Salsa De Soja - Agiibo - 5 Lts. Ideal Uso Gastronómico,6990.0,https://www.mercadolibre.com.ar/salsa-de-soja-agiibo-5-lts-ideal-uso-gastronomico/p/MLA24065498
129,Salsa De Soja En Sachet 10 Cc X 100 U Sushi Cocina Japonesa,4370.0,https://articulo.mercadolibre.com.ar/MLA-689949722-salsa-de-soja-en-sachet-10-cc-x-100-u-sushi-cocina-japonesa-_JM
130,Blister Salsa Soja Bitarwan 45 Cc - Caja X 169 Und,13817.0,https://articulo.mercadolibre.com.ar/MLA-782017656-blister-salsa-soja-bitarwan-45-cc-caja-x-169-und-_JM
131,Salsa De Soja Agiibo 5 L - Ideal Uso Gastronómico ,6046.0,https://articulo.mercadolibre.com.ar/MLA-923768005-salsa-de-soja-agiibo-5-l-ideal-uso-gastronomico-_JM
132,Salsa De Soja Lee Kum Kee Premium 150 Ml,3670.0,https://articulo.mercadolibre.com.ar/MLA-853994998-salsa-de-soja-lee-kum-kee-premium-150-ml-_JM
133,Salsa De Soja En Blíster 40gr X 60 Uni Sushi Comida Japonesa,9399.0,https://articulo.mercadolibre.com.ar/MLA-1112481950-salsa-de-soja-en-blister-40gr-x-60-uni-sushi-comida-japonesa-_JM
134,Salsa De Soja Oscura 500 Ml Marca Haday,3187.5,https://articulo.mercadolibre.com.ar/MLA-1470618770-salsa-de-soja-oscura-500-ml-marca-haday-_JM
135,Salsa De Soja Gell Singh Sin Sal Agregada - 500 Ml,1100.0,https://articulo.mercadolibre.com.ar/MLA-815199654-salsa-de-soja-gell-singh-sin-sal-agregada-500-ml-_JM
136,Pack X2 Salsa De Soja Sabor Hongo X500ml Lee Kum Kee,9999.0,https://articulo.mercadolibre.com.ar/MLA-884999473-pack-x2-salsa-de-soja-sabor-hongo-x500ml-lee-kum-kee-_JM
137,Salsa De Soja Reducida En Sodio X 148 Ml Yamasa,6900.0,https://articulo.mercadolibre.com.ar/MLA-866663263-salsa-de-soja-reducida-en-sodio-x-148-ml-yamasa-_JM
138,Salsa De Soja 500 Ml Kikkoman - Origen Japon,5858.0,https://articulo.mercadolibre.com.ar/MLA-875712005-salsa-de-soja-500-ml-kikkoman-origen-japon-_JM
139,Salsa De Soja Yamasa Tradicional 148 Ml. Origen Usa ,5684.0,https://articulo.mercadolibre.com.ar/MLA-934812489-salsa-de-soja-yamasa-tradicional-148-ml-origen-usa-_JM
140,Salsa De Soja Kikkoman Koikuchi 1 Lt Producto De Japón,9295.0,https://www.mercadolibre.com.ar/salsa-de-soja-kikkoman-koikuchi-1-lt-producto-de-japon/p/MLA24740699
141,Salsa De Soja Fumeiga En Sachet X 100u Ideal Delivery,3500.0,https://articulo.mercadolibre.com.ar/MLA-923108628-salsa-de-soja-fumeiga-en-sachet-x-100u-ideal-delivery-_JM
142,Salsa De Soja Fumeiga Premiun 5 Lt X 4 Und,33683.0,https://articulo.mercadolibre.com.ar/MLA-1428956516-salsa-de-soja-fumeiga-premiun-5-lt-x-4-und-_JM
143,Salsa De Soja Vanoli 190ml Sin Tacc ,851.0,https://www.mercadolibre.com.ar/salsa-de-soja-vanoli-190ml-sin-tacc/p/MLA21213050
144,Salsa De Soja Fumeiga X 5 L,6709.0,https://articulo.mercadolibre.com.ar/MLA-677873945-salsa-de-soja-fumeiga-x-5-l-_JM
145,Salsa De Soja Hinomoto Light Envase Vertedor 1 Lt,3849.0,https://articulo.mercadolibre.com.ar/MLA-1114947540-salsa-de-soja-hinomoto-light-envase-vertedor-1-lt-_JM
146,"Mrs Taste Salsa De Soja Sin Calorias, Baja En Sodio Brasil",4049.0,https://articulo.mercadolibre.com.ar/MLA-1123517725-mrs-taste-salsa-de-soja-sin-calorias-baja-en-sodio-brasil-_JM
147,Salsa De Soja Vanoli 190ml Sin Tacc  X6 Unidades,3857.0,https://articulo.mercadolibre.com.ar/MLA-1106970125-salsa-de-soja-vanoli-190ml-sin-tacc-x6-unidades-_JM
148,Salsa Soja Tahiti Blíster 40gr X 180u Sushi Comida Japonesa,13581.0,https://articulo.mercadolibre.com.ar/MLA-1147595863-salsa-soja-tahiti-blister-40gr-x-180u-sushi-comida-japonesa-_JM
149,Salsa De Soja Con Jengibre Cepera 130ml.,4395.0,https://articulo.mercadolibre.com.ar/MLA-1408908476-salsa-de-soja-con-jengibre-cepera-130ml-_JM
150,Salsa De Soja Fumeiga Tradicional 1 Litro,2330.0,https://articulo.mercadolibre.com.ar/MLA-910152396-salsa-de-soja-fumeiga-tradicional-1-litro-_JM
151,Salsa De Soja Fumeiga Tradicional 500ml,1329.0,https://articulo.mercadolibre.com.ar/MLA-927731245-salsa-de-soja-fumeiga-tradicional-500ml-_JM
152,Salsa De Soja - Sakanashi - 5 Lts.,14890.0,https://articulo.mercadolibre.com.ar/MLA-1209399231-salsa-de-soja-sakanashi-5-lts-_JM
153,Salsa De Soja Fincas Arezzo X500ml ,1697.56,https://articulo.mercadolibre.com.ar/MLA-918619599-salsa-de-soja-fincas-arezzo-x500ml-_JM
154,Salsa De Soja En Blíster 60 Uni X 30gr Sushi Comida Japonesa,4508.0,https://articulo.mercadolibre.com.ar/MLA-1497940528-salsa-de-soja-en-blister-60-uni-x-30gr-sushi-comida-japonesa-_JM
155,Salsa De Soja Certificada Organica X 900 Ml Fermento Natural,6850.0,https://articulo.mercadolibre.com.ar/MLA-831300088-salsa-de-soja-certificada-organica-x-900-ml-fermento-natural-_JM
156,Pack X 3 Salsa De Soja Extra Bitarwan  X 1 L,6578.0,https://articulo.mercadolibre.com.ar/MLA-931233883-pack-x-3-salsa-de-soja-extra-bitarwan-x-1-l-_JM
157,Salsa De Soja Extra Bitarwan  X 1 L,2555.0,https://www.mercadolibre.com.ar/salsa-de-soja-extra-bitarwan-x-1-l/p/MLA25987076
158,Salsa De Soja De Soja Dulce 190 Gr.,1937.5,https://articulo.mercadolibre.com.ar/MLA-930704378-salsa-de-soja-de-soja-dulce-190-gr-_JM
159,Salsa De Soja Levemente Salada 500 Ml - Fumeiga ,1357.0,https://articulo.mercadolibre.com.ar/MLA-1169745058-salsa-de-soja-levemente-salada-500-ml-fumeiga-_JM
160,Salsa De Soja 5l Sakanashi,11410.0,https://articulo.mercadolibre.com.ar/MLA-1355390054-salsa-de-soja-5l-sakanashi-_JM
161,Salsa De Soja Light Bitarwan X 500 Cc,1151.0,https://www.mercadolibre.com.ar/salsa-de-soja-light-bitarwan-x-500-cc/p/MLA24432420
162,Salsa De Soja Sakanashi Sabor Fuerte 970ml,2789.0,https://articulo.mercadolibre.com.ar/MLA-910159783-salsa-de-soja-sakanashi-sabor-fuerte-970ml-_JM
163,Salsa De Soja Kikkoman X 500 Ml. Origen Oriental.,5490.0,https://articulo.mercadolibre.com.ar/MLA-1161206649-salsa-de-soja-kikkoman-x-500-ml-origen-oriental-_JM
164,Salsa De Soja Cepera 1 Litro Origen Brasil Pack X3,11450.0,https://articulo.mercadolibre.com.ar/MLA-929589999-salsa-de-soja-cepera-1-litro-origen-brasil-pack-x3-_JM
165,"Pack X2 Salsa De Soja  X1,9 L Lee Kum Kee",21499.0,https://articulo.mercadolibre.com.ar/MLA-885005418-pack-x2-salsa-de-soja-x19-l-lee-kum-kee-_JM
166,Salsa De Soja Hinomoto 1 Lt ,3565.0,https://articulo.mercadolibre.com.ar/MLA-782150309-salsa-de-soja-hinomoto-1-lt-_JM
