,Title,Price,Link
0,Salsa Soja Clasica Lee Kum Kee 500ml Soy Sauce Natural,3103.11,https://www.mercadolibre.com.ar/salsa-soja-clasica-lee-kum-kee-500ml-soy-sauce-natural/p/MLA19620985
1,"Salsa De Soja  X1,9 L Lee Kum Kee",9164.0,https://www.mercadolibre.com.ar/salsa-de-soja-x19-l-lee-kum-kee/p/MLA19950547
2,Salsa De Soja Premium Lee Kum Kee 150 Ml,3332.0,https://www.mercadolibre.com.ar/salsa-de-soja-premium-lee-kum-kee-150-ml/p/MLA19799334
3,Aderezo Teriyaki Tau Delta X 320 Grs,1090.0,https://www.mercadolibre.com.ar/aderezo-teriyaki-tau-delta-x-320-grs/p/MLA22893959
4,Salsa Hoisin Lee Kum Kee 397gr,4889.01,https://www.mercadolibre.com.ar/salsa-hoisin-lee-kum-kee-397gr/p/MLA19783111
5,Salsa De Soja Oscura Con Champiñon Lee Kum Kee 500 Ml,3327.48,https://www.mercadolibre.com.ar/salsa-de-soja-oscura-con-champinon-lee-kum-kee-500-ml/p/MLA20004952
6,Salsa Estilo Teriyaki Lee Kum Kee 250ml Aderezo Salteado,5564.0,https://www.mercadolibre.com.ar/salsa-estilo-teriyaki-lee-kum-kee-250ml-aderezo-salteado/p/MLA20004048
7,Salsa De Soja Cepera Sin Tacc 150 Ml,1695.0,https://www.mercadolibre.com.ar/salsa-de-soja-cepera-sin-tacc-150-ml/p/MLA20004256
8,Salsa De Soja Red Cocinero X 500 Cc,741.02,https://articulo.mercadolibre.com.ar/MLA-1147036437-salsa-de-soja-red-cocinero-x-500-cc-_JM
9,Salsa De Soja Premium Lee Kum Kee 500 Ml,4284.0,https://www.mercadolibre.com.ar/salsa-de-soja-premium-lee-kum-kee-500-ml/p/MLA20004287
10,Salsa De Soja Reducida En Sodio Lee Kum Kee 500 Ml,6290.0,https://www.mercadolibre.com.ar/salsa-de-soja-reducida-en-sodio-lee-kum-kee-500-ml/p/MLA20004275
11,Salsa De Soja Fumeiga Cremosa 1lt Para Sushi Cocina Japon,2725.2,https://www.mercadolibre.com.ar/salsa-de-soja-fumeiga-cremosa-1lt-para-sushi-cocina-japon/p/MLA22317515
12,Salsa De Soja Agiibo 5 Lts Aderezo Cocina  Comida Japonesa,4562.5,https://www.mercadolibre.com.ar/salsa-de-soja-agiibo-5-lts-aderezo-cocina-comida-japonesa/p/MLA20004654
13,Salsa De Soja 160 Ml Zero Azúcar Mrs Taste Sin Tacc,3255.0,https://www.mercadolibre.com.ar/salsa-de-soja-160-ml-zero-azucar-mrs-taste-sin-tacc/p/MLA20004263
14,Salsa De Soja Kikkoman 1 Litro - Origen Oriental ,7780.0,https://www.mercadolibre.com.ar/salsa-de-soja-kikkoman-1-litro-origen-oriental/p/MLA20004022
15,Salsa De Soja Yamasa Tradicional 148 Ml.  ,5301.0,https://articulo.mercadolibre.com.ar/MLA-934810406-salsa-de-soja-yamasa-tradicional-148-ml-_JM
16,Salsa De Soja Bitarwan X 1lt,1826.85,https://www.mercadolibre.com.ar/salsa-de-soja-bitarwan-x-1lt/p/MLA21832876
17,Salsa De Soja Bitarwan X 5 Litros,6741.28,https://www.mercadolibre.com.ar/salsa-de-soja-bitarwan-x-5-litros/p/MLA21789434
18,Salsa De Soja Light Fumeiga 1lt Para Sushi Bajo Sodio Cocina,2464.0,https://www.mercadolibre.com.ar/salsa-de-soja-light-fumeiga-1lt-para-sushi-bajo-sodio-cocina/p/MLA23879282
19,Salsa De Soja Kikkoman 1.6l,12160.0,https://www.mercadolibre.com.ar/salsa-de-soja-kikkoman-16l/p/MLA24112193
20,Salsa De Soja Light Bitarwan X 1 L,1749.93,https://www.mercadolibre.com.ar/salsa-de-soja-light-bitarwan-x-1-l/p/MLA21832872
21,"Salsa De Soja Premium 1,9 L. Marca Haday",7885.0,https://www.mercadolibre.com.ar/salsa-de-soja-premium-19-l-marca-haday/p/MLA21832868
22,Salsa De Soja Yamasa Tradicional 459 Ml,9496.0,https://www.mercadolibre.com.ar/salsa-de-soja-yamasa-tradicional-459-ml/p/MLA21783597
23,Salsa De Soja 5 Litros Hei Mei,5499.0,https://www.mercadolibre.com.ar/salsa-de-soja-5-litros-hei-mei/p/MLA21634407
24,Salsa De Soja Reduccion La Parmesana X1und 300cc,647.1,https://articulo.mercadolibre.com.ar/MLA-881125475-salsa-de-soja-reduccion-la-parmesana-x1und-300cc-_JM
25,Salsa De Soja 500ml Vanoli,1150.0,https://www.mercadolibre.com.ar/salsa-de-soja-500ml-vanoli/p/MLA22761646
26,Salsa De Soja Premium X150ml Lee Kum Kee,4090.0,https://articulo.mercadolibre.com.ar/MLA-884714777-salsa-de-soja-premium-x150ml-lee-kum-kee-_JM
27,Salsa De Soja  Shoyu Sakura Tradicional 1 Lt 100% Natural Sakura - 1 - Unidad - 1 - 1 L (incluye: Es Salsa),4890.0,https://www.mercadolibre.com.ar/salsa-de-soja-shoyu-sakura-tradicional-1-lt-100-natural-sakura-1-unidad-1-1-l-incluye-es-salsa/p/MLA21832883
28,Salsa De Soja Cepera 150 Ml. Origen Brasil,1908.0,https://articulo.mercadolibre.com.ar/MLA-1124627342-salsa-de-soja-cepera-150-ml-origen-brasil-_JM
29,Salsa De Soja X 250ml - Hashi,764.0,https://www.mercadolibre.com.ar/salsa-de-soja-x-250ml-hashi/p/MLA19734534
30,Salsa De Soja 300 Ml Origen: China  100% Natural,4090.0,https://www.mercadolibre.com.ar/salsa-de-soja-300-ml-origen-china-100-natural/p/MLA22936286
31,Salsa De Soja Vanoli X 5l Sin Tacc,5313.0,https://articulo.mercadolibre.com.ar/MLA-920356604-salsa-de-soja-vanoli-x-5l-sin-tacc-_JM
32,Salsa De Soja Sin Sal Agregada 500 Ml Marca: Darama,1875.0,https://www.mercadolibre.com.ar/salsa-de-soja-sin-sal-agregada-500-ml-marca-darama/p/MLA21237875
33,Salsa De Soja Gell Singh Sin Sal Agregada - 3 Unidades,2143.0,https://www.mercadolibre.com.ar/salsa-de-soja-gell-singh-sin-sal-agregada-3-unidades/p/MLA21825897
34,Salsa De Soja Gluten Free Healthy Boy Brand 300g Tailandia,2240.0,https://www.mercadolibre.com.ar/salsa-de-soja-gluten-free-healthy-boy-brand-300g-tailandia/p/MLA21972479
35,Salsa De Soja Premium X 2lt Marca: Fumeiga,7055.0,https://www.mercadolibre.com.ar/salsa-de-soja-premium-x-2lt-marca-fumeiga/p/MLA21215820
36,Salsa De Soja Kikkoman Reducida En Sodio 500 Ml,6136.0,https://www.mercadolibre.com.ar/salsa-de-soja-kikkoman-reducida-en-sodio-500-ml/p/MLA21208136
37,Salsa De Soja Hinomoto Ligth 5 L - Sin Gluten,8950.0,https://www.mercadolibre.com.ar/salsa-de-soja-hinomoto-ligth-5-l-sin-gluten/p/MLA22437785
38,Salsa De Soja Fumeiga Estilo Japones O Cremosa 1000ml,2649.0,https://articulo.mercadolibre.com.ar/MLA-910155758-salsa-de-soja-fumeiga-estilo-japones-o-cremosa-1000ml-_JM
39,Salsa De Soja Kikkoman,4699.0,https://www.mercadolibre.com.ar/salsa-de-soja-kikkoman/p/MLA23705213
40,Salsa De Pescado X 1.6 Lt Origen: China,7790.0,https://www.mercadolibre.com.ar/salsa-de-pescado-x-16-lt-origen-china/p/MLA22725090
41,Salsa De Soja X 1 Lt Marca: Wan Ja Shan Origen: China,5062.5,https://articulo.mercadolibre.com.ar/MLA-851571605-salsa-de-soja-x-1-lt-marca-wan-ja-shan-origen-china-_JM
42,Salsa De Soja Yamasa Reducida En Sodio - Origen Japones,8290.0,https://www.mercadolibre.com.ar/salsa-de-soja-yamasa-reducida-en-sodio-origen-japones/p/MLA19855088
43,Salsa De Soja 1.6 L - Kikkoman,12430.0,https://articulo.mercadolibre.com.ar/MLA-861247230-salsa-de-soja-16-l-kikkoman-_JM
44,Salsa De Soja Tradicional 1 Lt - Bitarwan ,1780.0,https://articulo.mercadolibre.com.ar/MLA-855338478-salsa-de-soja-tradicional-1-lt-bitarwan-_JM
45,Salsa De Soja Haday 8 Un X 380ml China,3390.0,https://www.mercadolibre.com.ar/salsa-de-soja-haday-8-un-x-380ml-china/p/MLA24266810
46,Blister Salsa Soja Bitarwan 45 Cc - Caja X 169 Und,9970.0,https://articulo.mercadolibre.com.ar/MLA-782017656-blister-salsa-soja-bitarwan-45-cc-caja-x-169-und-_JM
47,Salsa De Soja Fermantación Natural 1 L. Marca Wan Ja Shan Wan Ja Shan Salsa De Soja Salsa - 1 - Unidad - 1 - Botella (incluye: Es Salsa),3450.0,https://www.mercadolibre.com.ar/salsa-de-soja-fermantacion-natural-1-l-marca-wan-ja-shan-wan-ja-shan-salsa-de-soja-salsa-1-unidad-1-botella-incluye-es-salsa/p/MLA22120731
48,Salsa De Soja Hinomoto X 500 Ml Light Suave,2060.0,https://www.mercadolibre.com.ar/salsa-de-soja-hinomoto-x-500-ml-light-suave/p/MLA24576317
49,Salsa De Ostras 700 Gr. Marca Haday,3250.0,https://www.mercadolibre.com.ar/salsa-de-ostras-700-gr-marca-haday/p/MLA21832875
